{"schemaVersion":1,"id":"org.hackeros.commands.du","name":"du","version":"1.0.0","publisherId":"pub.hackeros","description":"Estimate file space usage","kind":"terminal","entryPoint":{"assembly":"HackerOs.Commands.dll","type":"HackerOs.Commands.Du.DuCommand"},"sdkCompatibility":{"minimumVersion":"1.0.0"},"presentation":{"category":"utilities","launchVisibility":"hidden","iconAssetPaths":[]},"localizations":[],"capabilities":["filesystem.system.read","filesystem.user-home.read"],"declaredTopicPermissions":[],"resources":{"baselineCpuWeight":0.01,"burstCpuWeight":0.1,"baselineMemoryWeight":0.01,"burstMemoryWeight":0.08,"baselineStorageIoWeight":0.05,"burstStorageIoWeight":0.5,"baselineNetworkIoWeight":0,"burstNetworkIoWeight":0},"intents":[],"dependencies":[],"assets":[],"fileHandlers":[],"terminal":{"name":"du","aliases":[],"usage":"du [-a] [-s] [-h] [-c] [-d depth] [path...]"},"singleInstancePerUser":false,"autoStart":false,"supportsBack":false}
