{"schemaVersion":1,"id":"org.hackeros.commands.tee","name":"tee","version":"1.0.0","publisherId":"pub.hackeros","description":"Copy standard input to standard output and to files","kind":"terminal","entryPoint":{"assembly":"HackerOs.Commands.dll","type":"HackerOs.Commands.Tee.TeeCommand"},"sdkCompatibility":{"minimumVersion":"1.1.0"},"presentation":{"category":"utilities","launchVisibility":"hidden","iconAssetPaths":[]},"localizations":[{"culture":"fr","resourcePath":"localization/org.hackeros.commands.tee/fr.json"}],"capabilities":["filesystem.system.read","filesystem.user-home.read","filesystem.user-home.write"],"declaredTopicPermissions":[],"resources":{"baselineCpuWeight":0,"burstCpuWeight":0.01,"baselineMemoryWeight":0.01,"burstMemoryWeight":0.02,"baselineStorageIoWeight":0,"burstStorageIoWeight":0,"baselineNetworkIoWeight":0,"burstNetworkIoWeight":0},"intents":[],"dependencies":[],"assets":[],"fileHandlers":[],"terminal":{"name":"tee","aliases":[],"usage":"tee [-a] [file...]"},"singleInstancePerUser":false,"autoStart":false,"supportsBack":false,"execution":"pool"}
