{
  "schemaVersion": 1,
  "id": "org.hackeros.text-editor",
  "name": "Text Editor",
  "version": "1.4.0",
  "publisherId": "org.hackeros",
  "description": "A plain text and source code editor window application.",
  "kind": "window",
  "entryPoint": {
    "assembly": "HackerOs.Apps.TextEditor",
    "type": "HackerOs.Apps.TextEditor.TextEditorApp"
  },
  "sdkCompatibility": { "minimumVersion": "1.0.0" },
  "osCompatibility": { "minimumVersion": "3.0.0" },
  "presentation": {
    "category": "productivity",
    "launchVisibility": "visible",
    "iconAssetPaths": ["assets/icon-32.png", "assets/icon-256.png"]
  },
  "localizations": [
    { "culture": "en-US", "resourcePath": "assets/i18n/en-US.json" },
    { "culture": "fr-FR", "resourcePath": "assets/i18n/fr-FR.json" }
  ],
  "capabilities": ["fs.read.user-documents", "fs.write.user-documents"],
  "resources": {
    "baselineCpuWeight": 0.05,
    "burstCpuWeight": 0.2,
    "baselineMemoryWeight": 0.05,
    "burstMemoryWeight": 0.15,
    "baselineStorageIoWeight": 0.05,
    "burstStorageIoWeight": 0.1,
    "baselineNetworkIoWeight": 0.0,
    "burstNetworkIoWeight": 0.0
  },
  "settings": {
    "schemaVersion": 1,
    "fields": [
      {
        "key": "wordWrap",
        "valueType": "boolean",
        "defaultValue": "true",
        "scope": "appUser",
        "sensitivity": "public"
      },
      {
        "key": "theme",
        "valueType": "enum",
        "defaultValue": "dark",
        "scope": "appUser",
        "sensitivity": "public",
        "allowedValues": ["dark", "light"],
        "group": "appearance"
      }
    ]
  },
  "intents": [
    { "intentId": "org.hackeros.intent.openFile", "payloadSchemaAssetPath": "assets/intents/open-file.schema.json" }
  ],
  "assets": [
    { "path": "assets/icon-32.png", "kind": "image", "sha256": "00000000000000000000000000000000000000000000000000000000000000aa" },
    { "path": "assets/icon-256.png", "kind": "image", "sha256": "00000000000000000000000000000000000000000000000000000000000000bb" },
    { "path": "assets/i18n/en-US.json", "kind": "localization", "sha256": "00000000000000000000000000000000000000000000000000000000000000cc" },
    { "path": "assets/i18n/fr-FR.json", "kind": "localization", "sha256": "00000000000000000000000000000000000000000000000000000000000000dd" },
    { "path": "assets/intents/open-file.schema.json", "kind": "data", "sha256": "00000000000000000000000000000000000000000000000000000000000000ee" }
  ],
  "update": {
    "migrationIds": ["2024-01-add-word-wrap-setting"],
    "minimumUpgradableVersion": "1.0.0"
  },
  "fileHandlers": [
    {
      "mediaType": "text/plain",
      "extensions": [".txt", ".md"],
      "actions": ["open", "edit"],
      "priority": 10
    }
  ],
  "singleInstancePerUser": false
}
