{"schemaVersion":1,"id":"org.hackeros.commands.stress","name":"stress","version":"1.0.0","publisherId":"pub.hackeros","description":"Impose a CPU load on the system","kind":"terminal","entryPoint":{"assembly":"HackerOs.Commands.dll","type":"HackerOs.Commands.Stress.StressCommand"},"sdkCompatibility":{"minimumVersion":"0.9.0-preview.1"},"presentation":{"category":"utilities","launchVisibility":"hidden","iconAssetPaths":[]},"localizations":[{"culture":"fr","resourcePath":"localization/org.hackeros.commands.stress/fr.json"}],"capabilities":[],"declaredTopicPermissions":[],"resources":{"baselineCpuWeight":1,"burstCpuWeight":1,"baselineMemoryWeight":0.01,"burstMemoryWeight":0.01,"baselineStorageIoWeight":0,"burstStorageIoWeight":0,"baselineNetworkIoWeight":0,"burstNetworkIoWeight":0},"intents":[],"dependencies":[],"assets":[],"fileHandlers":[],"terminal":{"name":"stress","aliases":[],"usage":"stress [-c N] [-t SECONDS] [--yield]"},"singleInstancePerUser":false,"autoStart":false,"supportsBack":false,"execution":"pool"}
