{
  "schemaVersion": 1,
  "id": "org.hackeros.commands.mv",
  "name": "mv",
  "version": "1.0.0",
  "publisherId": "pub.hackeros",
  "description": "Move or rename files and directories",
  "kind": "terminal",
  "entryPoint": {
    "assembly": "HackerOs.Commands.Mv.dll",
    "type": "HackerOs.Commands.Mv.MvCommand"
  },
  "sdkCompatibility": {
    "minimumVersion": "1.0.0"
  },
  "presentation": {
    "category": "utilities",
    "launchVisibility": "hidden",
    "iconAssetPaths": []
  },
  "capabilities": [
    "filesystem.user-home.read",
    "filesystem.user-home.write",
    "filesystem.system.read",
    "filesystem.system.write"
  ],
  "resources": {
    "baselineCpuWeight": 0.01,
    "burstCpuWeight": 0.05,
    "baselineMemoryWeight": 0.01,
    "burstMemoryWeight": 0.05,
    "baselineStorageIoWeight": 0.05,
    "burstStorageIoWeight": 0.2,
    "baselineNetworkIoWeight": 0.0,
    "burstNetworkIoWeight": 0.0
  },
  "terminal": {
    "name": "mv",
    "aliases": [],
    "usage": "mv <source...> <destination>"
  },
  "singleInstancePerUser": false
}
