{"schemaVersion":1,"id":"org.hackeros.commands.printf","name":"printf","version":"1.0.0","publisherId":"pub.hackeros","description":"Format and print data","kind":"terminal","entryPoint":{"assembly":"HackerOs.Commands.dll","type":"HackerOs.Commands.Printf.PrintfCommand"},"sdkCompatibility":{"minimumVersion":"1.0.0"},"presentation":{"category":"utilities","launchVisibility":"hidden","iconAssetPaths":[]},"localizations":[],"capabilities":[],"declaredTopicPermissions":[],"resources":{"baselineCpuWeight":0,"burstCpuWeight":0.01,"baselineMemoryWeight":0.01,"burstMemoryWeight":0.02,"baselineStorageIoWeight":0,"burstStorageIoWeight":0,"baselineNetworkIoWeight":0,"burstNetworkIoWeight":0},"intents":[],"dependencies":[],"assets":[],"fileHandlers":[],"terminal":{"name":"printf","aliases":[],"usage":"printf format [argument...]"},"singleInstancePerUser":false,"autoStart":false,"supportsBack":false,"execution":"pool"}
