{
  "schemaVersion": 1,
  "id": "org.hackeros.calculator",
  "name": "Calculator",
  "version": "1.0.0",
  "publisherId": "pub.hackeros",
  "description": "Desktop calculator supporting arithmetic, scientific operations, and memory functions",
  "kind": "window",
  "entryPoint": {
    "assembly": "HackerOs.Apps.Calculator.dll",
    "type": "HackerOs.Apps.Calculator.CalculatorWindow"
  },
  "sdkCompatibility": {
    "minimumVersion": "1.0.0"
  },
  "presentation": {
    "category": "utilities",
    "launchVisibility": "visible",
    "iconAssetPaths": []
  },
  "capabilities": [],
  "resources": {
    "baselineCpuWeight": 0.01,
    "burstCpuWeight": 0.05,
    "baselineMemoryWeight": 0.01,
    "burstMemoryWeight": 0.05,
    "baselineStorageIoWeight": 0.0,
    "burstStorageIoWeight": 0.0,
    "baselineNetworkIoWeight": 0.0,
    "burstNetworkIoWeight": 0.0
  },
  "singleInstancePerUser": false
}
