{
  "schemaVersion": 1,
  "id": "org.hackeros.commands.help",
  "name": "help",
  "version": "1.0.0",
  "publisherId": "pub.hackeros",
  "description": "Display help and manual pages for commands",
  "kind": "terminal",
  "entryPoint": {
    "assembly": "HackerOs.Commands.Help.dll",
    "type": "HackerOs.Commands.Help.HelpCommand"
  },
  "sdkCompatibility": {
    "minimumVersion": "1.0.0"
  },
  "presentation": {
    "category": "utilities",
    "launchVisibility": "hidden",
    "iconAssetPaths": []
  },
  "capabilities": [],
  "resources": {
    "baselineCpuWeight": 0.0,
    "burstCpuWeight": 0.01,
    "baselineMemoryWeight": 0.0,
    "burstMemoryWeight": 0.01,
    "baselineStorageIoWeight": 0.0,
    "burstStorageIoWeight": 0.0,
    "baselineNetworkIoWeight": 0.0,
    "burstNetworkIoWeight": 0.0
  },
  "terminal": {
    "name": "help",
    "aliases": ["man"],
    "usage": "help [command]"
  },
  "singleInstancePerUser": false
}
