{"schemaVersion":1,"id":"org.hackeros.commands.jobs","name":"jobs","version":"1.0.0","publisherId":"pub.hackeros","description":"List the shell\u0027s background jobs","kind":"terminal","entryPoint":{"assembly":"HackerOs.Commands.dll","type":"HackerOs.Commands.Jobs.JobsCommand"},"sdkCompatibility":{"minimumVersion":"2.0.0"},"presentation":{"category":"utilities","launchVisibility":"hidden","iconAssetPaths":[]},"localizations":[{"culture":"fr","resourcePath":"localization/org.hackeros.commands.jobs/fr.json"}],"capabilities":["shell.control"],"declaredTopicPermissions":[],"resources":{"baselineCpuWeight":0,"burstCpuWeight":0.01,"baselineMemoryWeight":0.01,"burstMemoryWeight":0.02,"baselineStorageIoWeight":0,"burstStorageIoWeight":0,"baselineNetworkIoWeight":0,"burstNetworkIoWeight":0},"intents":[],"dependencies":[],"assets":[],"fileHandlers":[],"terminal":{"name":"jobs","aliases":[],"usage":"jobs [-l] [-p] [-r] [-s]"},"singleInstancePerUser":false,"autoStart":false,"supportsBack":false,"execution":"mainThread"}
