{
  "schemaVersion": 1,
  "id": "org.hackeros.commands.rm",
  "name": "rm",
  "version": "1.0.0",
  "publisherId": "pub.hackeros",
  "description": "Remove files or directories",
  "kind": "terminal",
  "entryPoint": {
    "assembly": "HackerOs.Commands.Rm.dll",
    "type": "HackerOs.Commands.Rm.RmCommand"
  },
  "sdkCompatibility": {
    "minimumVersion": "1.0.0"
  },
  "presentation": {
    "category": "utilities",
    "launchVisibility": "hidden",
    "iconAssetPaths": []
  },
  "capabilities": [
    "filesystem.user-home.read",
    "filesystem.user-home.write",
    "filesystem.system.read",
    "filesystem.system.write"
  ],
  "resources": {
    "baselineCpuWeight": 0.01,
    "burstCpuWeight": 0.05,
    "baselineMemoryWeight": 0.01,
    "burstMemoryWeight": 0.05,
    "baselineStorageIoWeight": 0.05,
    "burstStorageIoWeight": 0.2,
    "baselineNetworkIoWeight": 0.0,
    "burstNetworkIoWeight": 0.0
  },
  "terminal": {
    "name": "rm",
    "aliases": [],
    "usage": "rm [-r|-R] [-f] <file...>"
  },
  "singleInstancePerUser": false
}
