{"schemaVersion":1,"id":"org.hackeros.commands.nano","name":"nano","version":"1.0.0","publisherId":"pub.hackeros","description":"Terminal interactive text editor command","kind":"terminal","entryPoint":{"assembly":"HackerOs.Commands.dll","type":"HackerOs.Commands.Nano.NanoCommand"},"sdkCompatibility":{"minimumVersion":"2.0.0"},"presentation":{"category":"system","launchVisibility":"hidden","iconAssetPaths":[]},"localizations":[{"culture":"fr","resourcePath":"localization/org.hackeros.commands.nano/fr.json"}],"capabilities":["filesystem.system.read","filesystem.system.write","filesystem.user-home.read","filesystem.user-home.write"],"declaredTopicPermissions":[],"resources":{"baselineCpuWeight":0,"burstCpuWeight":0.05,"baselineMemoryWeight":0.01,"burstMemoryWeight":0.02,"baselineStorageIoWeight":0,"burstStorageIoWeight":0,"baselineNetworkIoWeight":0,"burstNetworkIoWeight":0},"intents":[],"dependencies":[],"assets":[],"fileHandlers":[],"terminal":{"name":"nano","aliases":[],"usage":"nano [file]"},"singleInstancePerUser":false,"autoStart":false,"supportsBack":false,"execution":"mainThread"}
