{"schemaVersion":1,"id":"org.hackeros.commands.cut","name":"cut","version":"1.0.0","publisherId":"pub.hackeros","description":"Remove sections from each line of files","kind":"terminal","entryPoint":{"assembly":"HackerOs.Commands.dll","type":"HackerOs.Commands.Cut.CutCommand"},"sdkCompatibility":{"minimumVersion":"2.0.3"},"presentation":{"category":"utilities","launchVisibility":"hidden","iconAssetPaths":[]},"localizations":[{"culture":"fr","resourcePath":"localization/org.hackeros.commands.cut/fr.json"}],"capabilities":["filesystem.system.read","filesystem.user-home.read"],"declaredTopicPermissions":[],"resources":{"baselineCpuWeight":0,"burstCpuWeight":0.01,"baselineMemoryWeight":0.01,"burstMemoryWeight":0.02,"baselineStorageIoWeight":0,"burstStorageIoWeight":0,"baselineNetworkIoWeight":0,"burstNetworkIoWeight":0},"intents":[],"dependencies":[],"assets":[],"fileHandlers":[],"terminal":{"name":"cut","aliases":[],"usage":"cut -f list [-d delim] [-s] | -c list | -b list [--complement] [file...]"},"singleInstancePerUser":false,"autoStart":false,"supportsBack":false,"execution":"pool"}
