{"schemaVersion":1,"id":"org.hackeros.commands.which","name":"which","version":"1.0.0","publisherId":"pub.hackeros","description":"Locate a command","kind":"terminal","entryPoint":{"assembly":"HackerOs.Commands.dll","type":"HackerOs.Commands.Which.WhichCommand"},"sdkCompatibility":{"minimumVersion":"0.9.0-preview.1"},"presentation":{"category":"utilities","launchVisibility":"hidden","iconAssetPaths":[]},"localizations":[{"culture":"fr","resourcePath":"localization/org.hackeros.commands.which/fr.json"}],"capabilities":["shell.control"],"declaredTopicPermissions":[],"resources":{"baselineCpuWeight":0,"burstCpuWeight":0.01,"baselineMemoryWeight":0.01,"burstMemoryWeight":0.02,"baselineStorageIoWeight":0,"burstStorageIoWeight":0,"baselineNetworkIoWeight":0,"burstNetworkIoWeight":0},"intents":[],"dependencies":[],"assets":[],"fileHandlers":[],"terminal":{"name":"which","aliases":[],"usage":"which [-a] name..."},"singleInstancePerUser":false,"autoStart":false,"supportsBack":false,"execution":"mainThread"}
