{"schemaVersion":1,"id":"org.hackeros.commands.help","name":"help","version":"1.0.0","publisherId":"pub.hackeros","description":"Display help and manual pages for commands","kind":"terminal","entryPoint":{"assembly":"HackerOs.Commands.dll","type":"HackerOs.Commands.Help.HelpCommand"},"sdkCompatibility":{"minimumVersion":"1.0.0"},"presentation":{"category":"utilities","launchVisibility":"hidden","iconAssetPaths":[]},"localizations":[],"capabilities":["shell.control"],"declaredTopicPermissions":[],"resources":{"baselineCpuWeight":0,"burstCpuWeight":0.01,"baselineMemoryWeight":0,"burstMemoryWeight":0.01,"baselineStorageIoWeight":0,"burstStorageIoWeight":0,"baselineNetworkIoWeight":0,"burstNetworkIoWeight":0},"intents":[],"dependencies":[],"assets":[],"fileHandlers":[],"terminal":{"name":"help","aliases":["man"],"usage":"help [command]"},"singleInstancePerUser":false,"autoStart":false,"supportsBack":false}
